<?xml version="1.0" encoding="UTF-8" ?>
<!DOCTYPE configuration SYSTEM "rpc-config.dtd">
<configuration>
    <port>8090</port>
    
    <applicationName>rpc-default-appName</applicationName>
    
    <registry url="zookeeper://127.0.0.1:2181"/>

    <serializeType type="jdk"/>
    <serializer class="com.fg.serialize.service.Impl.HessianSerializer"/>

    <compressType type="gzip"/>
    <compressor class="com.fg.compress.service.Impl.GzipCompressor"/>
    
    <loadBalancerType type="RoundRobin"/>
    <loadBalancer class="com.fg.loadbalancer.service.Impl.RoundRobinLoadBalancer"/>

    <idGenerator class="com.fg.IdGenerator" dataCenterId="1" machineId="2"/>
</configuration>