<?xml version="1.0" encoding="UTF-8" ?>
<!DOCTYPE configuration SYSTEM "rpc-config.dtd">
<configuration>
    <port>8088</port>
    
    <applicationName>rpc-default-appName</applicationName>
    
    <registry url="zookeeper://127.0.0.1:2181"/>

    <serializeType type="hessian"/>
    <serializer code="3" type="hessian" class="com.fg.serialize.service.impl.HessianSerializer"/>

    <compressType type="gzip"/>
    <compressor code="1" type="gzip" class="com.fg.compress.service.impl.GzipCompressor"/>

    <loadBalancerType type="RoundRobin"/>
    <loadBalancer class="com.fg.loadbalancer.service.impl.RoundRobinLoadBalancer"/>

    <idGenerator class="com.fg.IdGenerator" dataCenterId="1" machineId="2"/>
</configuration>